{
  "schema_version": "benchmark-package-manifest-v0.1",
  "benchmark_id": "TEST-ONLY-BENCH",
  "task_id": "TEST-ONLY-TASK",
  "task_version": "TEST-ONLY-v1",
  "display_name": "TEST ONLY copy task",
  "task_kind": "test_only_copy",
  "description": "Synthetic UI regression only; never business evidence.",
  "rubric_ref": "test-only://copy-ready-v1",
  "review_as_of": "2026-10-02",
  "acceptance": {
    "requirement_count": 1
  },
  "input_files": [
    {
      "path": "test-only-task.txt",
      "media_type": "text/plain",
      "size_bytes": 102,
      "sha256": "51d19ec2ddfa145ca2c3a4f534d71416eb20632dd83cd815a7e2dcc7be8b63ea"
    }
  ],
  "reference_answers": {
    "included_in_package": false,
    "mode": "sealed_external",
    "reference_set_id": "TEST-ONLY-development-fixture",
    "unlock_policy": "after_output_submission"
  },
  "created_at": "2026-10-01T16:00:00.000Z"
}